{
  "format_version": 1,
  "id": "sk-congruent-match",
  "kind": "skill",
  "key": "math.congruent-triangles:s-II-2#b@4",
  "grade_min": 4,
  "ladder_ids": [
    "s-II-2#b@4"
  ],
  "curriculum_codes": [
    "S-4-6"
  ],
  "title": {
    "text": "找對應邊與對應角",
    "audio": null
  },
  "generator": "math.congruent-triangles",
  "generator_version": 1,
  "params": {
    "tiers": [
      "side",
      "angle"
    ],
    "weights": {
      "side": 1,
      "angle": 1
    },
    "rotate": true
  },
  "meta": {
    "author": "claude-code",
    "reviewed": false
  }
}
